{
  "schemaVersion": "1.0",
  "manifestSchemaVersion": "1.0",
  "orderingPolicy": "migration-first-manifest-order-v1",
  "mode": "plan",
  "toolkitVersion": "0.2.1",
  "installedToolkitVersion": "0.1.0",
  "options": {
    "initializeProjectStructure": false,
    "forceManagedFiles": false
  },
  "canApply": true,
  "actions": [
    {
      "sequence": 1,
      "action": "backup",
      "entryId": "managed-framework-readme",
      "source": "Toolkit/payload/sdp-root/Framework/README.md",
      "generator": null,
      "targetSource": null,
      "targetSourceSha256": null,
      "destinationPrecondition": null,
      "destination": "SDP/Framework/README.md",
      "ownership": "toolkit-managed",
      "reason": "backup-before-replace",
      "mutatesTarget": true,
      "oldToolkitVersion": "0.1.0",
      "newToolkitVersion": "0.2.1"
    },
    {
      "sequence": 2,
      "action": "replace",
      "entryId": "managed-framework-readme",
      "source": "Toolkit/payload/sdp-root/Framework/README.md",
      "generator": null,
      "targetSource": null,
      "targetSourceSha256": null,
      "destinationPrecondition": null,
      "destination": "SDP/Framework/README.md",
      "ownership": "toolkit-managed",
      "reason": "refresh-managed-content",
      "mutatesTarget": true,
      "oldToolkitVersion": "0.1.0",
      "newToolkitVersion": "0.2.1"
    },
    {
      "sequence": 3,
      "action": "backup",
      "entryId": "generated-installed-toolkit-manifest",
      "source": null,
      "generator": "installed-toolkit-manifest",
      "targetSource": null,
      "targetSourceSha256": null,
      "destinationPrecondition": null,
      "destination": "SDP/Framework/installed-toolkit.manifest.yaml",
      "ownership": "toolkit-managed",
      "reason": "backup-before-replace",
      "mutatesTarget": true,
      "oldToolkitVersion": "0.1.0",
      "newToolkitVersion": "0.2.1"
    },
    {
      "sequence": 4,
      "action": "generate",
      "entryId": "generated-installed-toolkit-manifest",
      "source": null,
      "generator": "installed-toolkit-manifest",
      "targetSource": null,
      "targetSourceSha256": null,
      "destinationPrecondition": null,
      "destination": "SDP/Framework/installed-toolkit.manifest.yaml",
      "ownership": "toolkit-managed",
      "reason": "refresh-generated-content",
      "mutatesTarget": true,
      "oldToolkitVersion": "0.1.0",
      "newToolkitVersion": "0.2.1"
    },
    {
      "sequence": 5,
      "action": "preserve",
      "entryId": "project-manifest",
      "source": "Template/sdp-root/SDP-project.manifest.yaml",
      "generator": null,
      "targetSource": null,
      "targetSourceSha256": null,
      "destinationPrecondition": null,
      "destination": "SDP/SDP-project.manifest.yaml",
      "ownership": "project-owned",
      "reason": "missing-only-content",
      "mutatesTarget": false,
      "oldToolkitVersion": "0.1.0",
      "newToolkitVersion": "0.2.1"
    }
  ]
}
