{
  "schemaVersion": "1.0",
  "manifestSchemaVersion": "1.0",
  "orderingPolicy": "migration-first-manifest-order-v1",
  "mode": "plan",
  "toolkitVersion": "0.2.1",
  "installedToolkitVersion": null,
  "options": {
    "initializeProjectStructure": false,
    "forceManagedFiles": false
  },
  "canApply": false,
  "actions": [
    {
      "sequence": 1,
      "action": "block",
      "entryId": "project-manifest",
      "source": null,
      "generator": null,
      "targetSource": null,
      "targetSourceSha256": null,
      "destinationPrecondition": null,
      "destination": "SDP/SDP-project.manifest.yaml",
      "ownership": "project-owned",
      "reason": "unsupported-project-schema",
      "mutatesTarget": false,
      "oldToolkitVersion": null,
      "newToolkitVersion": "0.2.1"
    }
  ]
}
